{
  "query": "serde",
  "page": 1,
  "per_page": 10,
  "sort": "relevance",
  "hits": [
    {
      "name": "serde",
      "description": "A generic serialization/deserialization framework",
      "downloads": 500000000,
      "version": "1.0.210",
      "documentation": "https://docs.rs/serde",
      "max_version": "1.0.210",
      "max_stable_version": "1.0.210",
      "default_version": "1.0.210",
      "recent_downloads": 10000000,
      "exact_match": true,
      "yanked": false,
      "repository": "https://github.com/serde-rs/serde",
      "homepage": "https://serde.rs"
    },
    {
      "name": "serde_json",
      "description": "No description available",
      "downloads": 400000000,
      "version": "1.0.128",
      "documentation": "https://docs.rs/serde_json",
      "max_version": "1.0.128",
      "exact_match": false
    }
  ],
  "meta": {
    "total": 2,
    "next_page": "page=2"
  }
}
